{
  "contract_version": "w02-0.1.0-draft",
  "run_id": "RUN-a190a5e98c3942f186e5f3ab75af7f08",
  "stage": "extraction",
  "mode": "live",
  "status": "failed",
  "model": {
    "provider": "api.siliconflow.cn",
    "name": "deepseek-ai/DeepSeek-V4.1-Flash",
    "adapter_version": "w02-extractor-0.1.0"
  },
  "implementation": [
    {
      "path": "artifacts/w02/runs/RUN-a190a5e98c3942f186e5f3ab75af7f08/implementation/platform/fde_product/interview_extraction.py",
      "sha256": "4158dd8cf48092fbd515c562e326d403e60d15feb76511dd04b9991c77de6e53"
    },
    {
      "path": "artifacts/w02/runs/RUN-a190a5e98c3942f186e5f3ab75af7f08/implementation/platform/fde_product/models.py",
      "sha256": "17cac712394ede304b9d57f2c3adcf4cb5739bbd6264880efb9603bc5dacb223"
    },
    {
      "path": "artifacts/w02/runs/RUN-a190a5e98c3942f186e5f3ab75af7f08/implementation/tools/w02_interviews.py",
      "sha256": "7dc6d6e55add4179c10f6cd41944606ee0a7a722ca2e5bc30b25ca4db31a3e00"
    }
  ],
  "configuration": [
    {
      "path": "artifacts/w02/runs/RUN-a190a5e98c3942f186e5f3ab75af7f08/snapshot/customer/w02/eval/extraction_eval_default.json",
      "sha256": "791a43d43ccfcc01fa3039685200ca532c9daedd8b16d986bd04b208673e0327"
    },
    {
      "path": "artifacts/w02/runs/RUN-a190a5e98c3942f186e5f3ab75af7f08/snapshot/customer/w02/eval/prompt_default.txt",
      "sha256": "f287d1329a1e00a041bae3cb0ae674c66fb57f19f43aef2d36be7c1f9932d091"
    },
    {
      "path": "artifacts/w02/runs/RUN-a190a5e98c3942f186e5f3ab75af7f08/contracts/transcript.schema.json",
      "sha256": "855f84b576d3f0b7bea82eac6b817fc0c8c723040f131f43075380110a823f9f"
    },
    {
      "path": "artifacts/w02/runs/RUN-a190a5e98c3942f186e5f3ab75af7f08/contracts/interview_facts.schema.json",
      "sha256": "34358b1f9cca39f17f3d7b74abda732460be0beaba2f93b8e8f8bcaa3d2e0a80"
    },
    {
      "path": "artifacts/w02/runs/RUN-a190a5e98c3942f186e5f3ab75af7f08/contracts/run_evidence.schema.json",
      "sha256": "4fed42abba5d6f9a727c52d6e3097e965ffa3b02ef855aadb2387ab1f890ebce"
    },
    {
      "path": "artifacts/w02/runs/RUN-a190a5e98c3942f186e5f3ab75af7f08/settings.json",
      "sha256": "bda5f737effb97a53bd99d3d70ae7432877f062d164eaebf4495d235c58380c9"
    }
  ],
  "inputs": [
    {
      "path": "artifacts/w02/runs/RUN-a190a5e98c3942f186e5f3ab75af7f08/snapshot/artifacts/w02/sources/W2-interview-6c1d37b4-9a0c-5106-8e00-9852640f4ea4-transcript.json",
      "sha256": "993be8707c253f277289a4011117ecb66e64bac63dad7c8cc60d7af8212cca43"
    },
    {
      "path": "artifacts/w02/runs/RUN-a190a5e98c3942f186e5f3ab75af7f08/snapshot/artifacts/w02/sources/W2-interview-c4a59a18-4bff-535c-a011-dd0dd0d508fd-transcript.json",
      "sha256": "02ad528172ab0fbba0d960cddb3c14646c1f351fd780379ca0fd0328ff93ffab"
    },
    {
      "path": "artifacts/w02/runs/RUN-a190a5e98c3942f186e5f3ab75af7f08/snapshot/artifacts/w02/sources/W2-interview-f97c78e0-6636-5021-9f78-4daba5b3931c-transcript.json",
      "sha256": "76ff207e8362bfa12a83331f9ecb8272190d04fb7679a108e7dbe99ac885ce5d"
    }
  ],
  "outputs": [
    {
      "path": "artifacts/w02/runs/RUN-a190a5e98c3942f186e5f3ab75af7f08/step-001.request.json",
      "sha256": "b15457850a2b3584cc82e0bc81267bc2717379bf1f4e63bcce54c86276bb9751"
    },
    {
      "path": "artifacts/w02/runs/RUN-a190a5e98c3942f186e5f3ab75af7f08/step-001.attempts.json",
      "sha256": "6a4fb70e8f9ea9dc1a85111e4fc7569c4e3fab934f54893e4d4d521d9cbcf953"
    },
    {
      "path": "artifacts/w02/runs/RUN-a190a5e98c3942f186e5f3ab75af7f08/steps.json",
      "sha256": "9433d7b525d78fc4b42fde2b362b9c06c5c0587cdc7e10c4d030ef7807311dc5"
    }
  ],
  "error": {
    "code": "MODEL_TIMEOUT",
    "message": "本次失败；保留已有请求与公开响应，核对后创建新运行。"
  }
}
