{
  "contract_version": "w02-0.1.0-draft",
  "run_id": "RUN-aa3064ef90884ed482e5657fd7592eac",
  "stage": "extraction",
  "mode": "live",
  "status": "failed",
  "model": {
    "provider": "api.siliconflow.cn",
    "name": "deepseek-ai/DeepSeek-V4.1-Flash",
    "adapter_version": "w02-extractor-0.1.0"
  },
  "implementation": [
    {
      "path": "artifacts/w02/runs/RUN-aa3064ef90884ed482e5657fd7592eac/implementation/platform/fde_product/interview_extraction.py",
      "sha256": "4158dd8cf48092fbd515c562e326d403e60d15feb76511dd04b9991c77de6e53"
    },
    {
      "path": "artifacts/w02/runs/RUN-aa3064ef90884ed482e5657fd7592eac/implementation/platform/fde_product/models.py",
      "sha256": "17cac712394ede304b9d57f2c3adcf4cb5739bbd6264880efb9603bc5dacb223"
    },
    {
      "path": "artifacts/w02/runs/RUN-aa3064ef90884ed482e5657fd7592eac/implementation/tools/w02_interviews.py",
      "sha256": "7dc6d6e55add4179c10f6cd41944606ee0a7a722ca2e5bc30b25ca4db31a3e00"
    }
  ],
  "configuration": [
    {
      "path": "artifacts/w02/runs/RUN-aa3064ef90884ed482e5657fd7592eac/snapshot/customer/w02/eval/extraction_eval_default.json",
      "sha256": "0401bd2d219ef071360e5758fd77ec6f0207b88afb0c38afda1098576531a5c0"
    },
    {
      "path": "artifacts/w02/runs/RUN-aa3064ef90884ed482e5657fd7592eac/snapshot/customer/w02/eval/prompt_default.txt",
      "sha256": "f287d1329a1e00a041bae3cb0ae674c66fb57f19f43aef2d36be7c1f9932d091"
    },
    {
      "path": "artifacts/w02/runs/RUN-aa3064ef90884ed482e5657fd7592eac/contracts/transcript.schema.json",
      "sha256": "855f84b576d3f0b7bea82eac6b817fc0c8c723040f131f43075380110a823f9f"
    },
    {
      "path": "artifacts/w02/runs/RUN-aa3064ef90884ed482e5657fd7592eac/contracts/interview_facts.schema.json",
      "sha256": "34358b1f9cca39f17f3d7b74abda732460be0beaba2f93b8e8f8bcaa3d2e0a80"
    },
    {
      "path": "artifacts/w02/runs/RUN-aa3064ef90884ed482e5657fd7592eac/contracts/run_evidence.schema.json",
      "sha256": "4fed42abba5d6f9a727c52d6e3097e965ffa3b02ef855aadb2387ab1f890ebce"
    },
    {
      "path": "artifacts/w02/runs/RUN-aa3064ef90884ed482e5657fd7592eac/settings.json",
      "sha256": "875430b3f935dd83ab8994808792d0100cfa338e3b291f76cdf82cd391bc65de"
    }
  ],
  "inputs": [
    {
      "path": "artifacts/w02/runs/RUN-aa3064ef90884ed482e5657fd7592eac/snapshot/artifacts/w02/sources/W2-interview-6c1d37b4-9a0c-5106-8e00-9852640f4ea4-transcript.json",
      "sha256": "993be8707c253f277289a4011117ecb66e64bac63dad7c8cc60d7af8212cca43"
    },
    {
      "path": "artifacts/w02/runs/RUN-aa3064ef90884ed482e5657fd7592eac/snapshot/artifacts/w02/sources/W2-interview-c4a59a18-4bff-535c-a011-dd0dd0d508fd-transcript.json",
      "sha256": "02ad528172ab0fbba0d960cddb3c14646c1f351fd780379ca0fd0328ff93ffab"
    },
    {
      "path": "artifacts/w02/runs/RUN-aa3064ef90884ed482e5657fd7592eac/snapshot/artifacts/w02/sources/W2-interview-f97c78e0-6636-5021-9f78-4daba5b3931c-transcript.json",
      "sha256": "76ff207e8362bfa12a83331f9ecb8272190d04fb7679a108e7dbe99ac885ce5d"
    }
  ],
  "outputs": [
    {
      "path": "artifacts/w02/runs/RUN-aa3064ef90884ed482e5657fd7592eac/step-001.request.json",
      "sha256": "e72261bfd01848c7623d9ec82c86e9fdd9dac5b95f38b77d1e3efdb30da6273c"
    },
    {
      "path": "artifacts/w02/runs/RUN-aa3064ef90884ed482e5657fd7592eac/step-001.attempts.json",
      "sha256": "49f9ad4d189d9d4e441b520adfca1666c17980453f8db982f07086fceb425279"
    },
    {
      "path": "artifacts/w02/runs/RUN-aa3064ef90884ed482e5657fd7592eac/steps.json",
      "sha256": "f5b455701b2c36fdcd3e5b442fb8b88042dc66d6c3afb328f66922194dac8b49"
    }
  ],
  "error": {
    "code": "MODEL_NETWORK_ERROR",
    "message": "本次失败；保留已有请求与公开响应，核对后创建新运行。"
  }
}
